{
  "id": "growth",
  "kind": "domain",
  "title": "个人成长系统",
  "document": "growth/README.md",
  "parentId": "global",
  "positioning": "围绕目标、任务、待办、习惯与时间追踪形成个人成长闭环。",
  "dependencies": [
    "global"
  ],
  "references": [
    {
      "id": "growth.overview",
      "heading": "## 成长闭环"
    },
    {
      "id": "growth.architecture",
      "heading": "## 模块协作"
    },
    {
      "id": "growth.design",
      "heading": "## 体验原则"
    }
  ],
  "productStatus": "roadmap",
  "prototypeCoverage": "complete",
  "changeLog": [
    {
      "version": "v0.1.0",
      "date": "2026-07-28",
      "event": "baseline",
      "summary": "建立 ProductWiki 结构化基线。",
      "productStatus": "roadmap",
      "prototypeCoverage": "complete"
    }
  ]
}
