{
  "id": "growth.task",
  "kind": "module",
  "title": "任务管理",
  "document": "growth/task/README.md",
  "parentId": "growth",
  "route": "/growth/task",
  "positioning": "承接目标拆解，并向待办和时间追踪下发执行颗粒。",
  "dependencies": [
    "growth.goal"
  ],
  "entities": [
    {
      "id": "task",
      "name": "任务",
      "fields": [
        {
          "id": "goalId",
          "name": "关联目标",
          "type": "reference",
          "required": false,
          "description": "非子任务关联目标。",
          "productStatus": "roadmap",
          "prototypeCoverage": "complete",
          "changeLog": [
            {
              "version": "v0.1.0",
              "date": "2026-07-28",
              "event": "baseline",
              "summary": "建立字段基线。",
              "productStatus": "roadmap",
              "prototypeCoverage": "complete"
            }
          ]
        },
        {
          "id": "parentId",
          "name": "父任务",
          "type": "reference",
          "required": false,
          "description": "子任务关联父任务。",
          "productStatus": "roadmap",
          "prototypeCoverage": "complete",
          "changeLog": [
            {
              "version": "v0.1.0",
              "date": "2026-07-28",
              "event": "baseline",
              "summary": "建立字段基线。",
              "productStatus": "roadmap",
              "prototypeCoverage": "complete"
            }
          ]
        },
        {
          "id": "status",
          "name": "状态",
          "type": "enum",
          "required": true,
          "values": [
            "todo",
            "doing",
            "done",
            "abandoned"
          ],
          "description": "任务执行状态。",
          "productStatus": "roadmap",
          "prototypeCoverage": "complete",
          "changeLog": [
            {
              "version": "v0.1.0",
              "date": "2026-07-28",
              "event": "baseline",
              "summary": "建立字段基线。",
              "productStatus": "roadmap",
              "prototypeCoverage": "complete"
            },
            {
              "version": "v0.1.1",
              "date": "2026-07-30",
              "event": "changed",
              "summary": "移除受阻状态。",
              "productStatus": "roadmap",
              "prototypeCoverage": "complete"
            }
          ]
        },
        {
          "id": "estimated",
          "name": "预计耗时",
          "type": "number",
          "required": true,
          "description": "用于排程和时间对比。",
          "productStatus": "roadmap",
          "prototypeCoverage": "complete",
          "changeLog": [
            {
              "version": "v0.1.0",
              "date": "2026-07-28",
              "event": "baseline",
              "summary": "建立字段基线。",
              "productStatus": "roadmap",
              "prototypeCoverage": "complete"
            }
          ]
        }
      ],
      "productStatus": "roadmap",
      "prototypeCoverage": "complete",
      "changeLog": [
        {
          "version": "v0.1.0",
          "date": "2026-07-28",
          "event": "baseline",
          "summary": "建立产品对象基线。",
          "productStatus": "roadmap",
          "prototypeCoverage": "complete"
        }
      ]
    }
  ],
  "views": [
    {
      "id": "today",
      "name": "今日任务",
      "prototypePage": "task",
      "scenario": "聚焦当日执行与逾期事项",
      "reference": "growth.task.view.today",
      "productStatus": "roadmap",
      "prototypeCoverage": "partial",
      "changeLog": [
        {
          "version": "v0.1.0",
          "date": "2026-07-29",
          "event": "baseline",
          "summary": "建立今日任务视图。",
          "productStatus": "roadmap",
          "prototypeCoverage": "partial"
        }
      ]
    },
    {
      "id": "week",
      "name": "本周任务",
      "prototypePage": "task",
      "scenario": "分组管理当前周执行",
      "reference": "growth.task.view.week",
      "productStatus": "roadmap",
      "prototypeCoverage": "partial",
      "changeLog": [
        {
          "version": "v0.1.0",
          "date": "2026-07-28",
          "event": "baseline",
          "summary": "建立视图基线。",
          "productStatus": "roadmap",
          "prototypeCoverage": "partial"
        }
      ]
    },
    {
      "id": "all",
      "name": "全部任务",
      "prototypePage": "task",
      "scenario": "全量筛选与治理",
      "reference": "growth.task.view.all",
      "productStatus": "roadmap",
      "prototypeCoverage": "partial",
      "changeLog": [
        {
          "version": "v0.1.0",
          "date": "2026-07-28",
          "event": "baseline",
          "summary": "建立视图基线。",
          "productStatus": "roadmap",
          "prototypeCoverage": "partial"
        }
      ]
    },
    {
      "id": "statistics",
      "name": "任务统计",
      "prototypePage": "task",
      "scenario": "复盘任务执行状态",
      "reference": "growth.task.view.statistics",
      "productStatus": "roadmap",
      "prototypeCoverage": "partial",
      "changeLog": [
        {
          "version": "v0.1.0",
          "date": "2026-07-29",
          "event": "baseline",
          "summary": "建立任务执行概览。",
          "productStatus": "roadmap",
          "prototypeCoverage": "partial"
        }
      ]
    },
    {
      "id": "calendar",
      "name": "月度排程",
      "prototypePage": "task",
      "scenario": "查看任务日期安排",
      "reference": "growth.task.view.calendar",
      "productStatus": "roadmap",
      "prototypeCoverage": "partial",
      "changeLog": [
        {
          "version": "v0.1.0",
          "date": "2026-07-28",
          "event": "baseline",
          "summary": "建立视图基线。",
          "productStatus": "roadmap",
          "prototypeCoverage": "partial"
        }
      ]
    },
    {
      "id": "detail",
      "name": "任务详情",
      "prototypePage": "task",
      "scenario": "独立运营任务及其关联对象",
      "productStatus": "roadmap",
      "prototypeCoverage": "partial",
      "reference": "growth.task.view.detail",
      "changeLog": [
        {
          "version": "v0.1.0",
          "date": "2026-07-28",
          "event": "baseline",
          "summary": "建立 prototype 抽屉覆盖基线。",
          "productStatus": "roadmap",
          "prototypeCoverage": "partial"
        }
      ]
    }
  ],
  "rules": [
    {
      "id": "single-parent",
      "name": "关联互斥",
      "entities": [
        "task"
      ],
      "description": "任务应关联目标或父任务，避免形成双重上级。",
      "views": [
        "today",
        "week",
        "all"
      ],
      "reference": "growth.task.rule.single-parent",
      "productStatus": "roadmap",
      "prototypeCoverage": "partial",
      "changeLog": [
        {
          "version": "v0.1.0",
          "date": "2026-07-28",
          "event": "baseline",
          "summary": "建立规则基线。",
          "productStatus": "roadmap",
          "prototypeCoverage": "partial"
        }
      ]
    },
    {
      "id": "time-inheritance",
      "name": "时间继承",
      "entities": [
        "task"
      ],
      "description": "子任务时间范围受父级目标或任务约束。",
      "views": [
        "today",
        "week",
        "calendar"
      ],
      "reference": "growth.task.rule.time-inheritance",
      "productStatus": "roadmap",
      "prototypeCoverage": "partial",
      "changeLog": [
        {
          "version": "v0.1.0",
          "date": "2026-07-28",
          "event": "baseline",
          "summary": "建立规则基线。",
          "productStatus": "roadmap",
          "prototypeCoverage": "partial"
        }
      ]
    }
  ],
  "references": [
    {
      "id": "growth.task.overview",
      "heading": "## 目标与价值"
    },
    {
      "id": "growth.task.structure",
      "heading": "## 业务流程"
    },
    {
      "id": "growth.task.view.today",
      "heading": "### 今日任务"
    },
    {
      "id": "growth.task.view.week",
      "heading": "### 本周任务"
    },
    {
      "id": "growth.task.view.all",
      "heading": "### 全部任务"
    },
    {
      "id": "growth.task.view.statistics",
      "heading": "### 任务统计"
    },
    {
      "id": "growth.task.view.calendar",
      "heading": "### 月度排程"
    },
    {
      "id": "growth.task.view.detail",
      "heading": "### 任务详情"
    },
    {
      "id": "growth.task.interaction",
      "heading": "## 交互语义"
    },
    {
      "id": "growth.task.rule.single-parent",
      "heading": "### 关联互斥"
    },
    {
      "id": "growth.task.rule.time-inheritance",
      "heading": "### 时间继承"
    }
  ],
  "productStatus": "roadmap",
  "prototypeCoverage": "complete",
  "changeLog": [
    {
      "version": "v0.1.0",
      "date": "2026-07-28",
      "event": "baseline",
      "summary": "建立 ProductWiki 结构化基线。",
      "productStatus": "roadmap",
      "prototypeCoverage": "complete"
    }
  ]
}
